No.     Time           Source                Destination           Protocol  
      1 0.000000000    Cisco_73:97:10        Spanning-tree-(for-bridges)_00 STP      Conf. Root = 4096/731/00:0a:8a:97:74:80  Cost = 3004  Port = 0x8010

Frame 1: 60 bytes on wire (480 bits), 60 bytes captured (480 bits) on interface 0
    Interface id: 0 (enp4s0)
    Encapsulation type: Ethernet (1)
    Arrival Time: Nov  6, 2017 12:10:27.765559678 WET
    [Time shift for this packet: 0.000000000 seconds]
    Epoch Time: 1509970227.765559678 seconds
    [Time delta from previous captured frame: 0.000000000 seconds]
    [Time delta from previous displayed frame: 0.000000000 seconds]
    [Time since reference or first frame: 0.000000000 seconds]
    Frame Number: 1
    Frame Length: 60 bytes (480 bits)
    Capture Length: 60 bytes (480 bits)
    [Frame is marked: False]
    [Frame is ignored: False]
    [Protocols in frame: eth:llc:stp]
    [Coloring Rule Name: Broadcast]
    [Coloring Rule String: eth[0] & 1]
IEEE 802.3 Ethernet 
Logical-Link Control
Spanning Tree Protocol

No.     Time           Source                Destination           Protocol  
      2 0.753882786    192.168.73.201        31.13.90.2            TLSv1.2  Application Data

Frame 2: 112 bytes on wire (896 bits), 112 bytes captured (896 bits) on interface 0
    Interface id: 0 (enp4s0)
    Encapsulation type: Ethernet (1)
    Arrival Time: Nov  6, 2017 12:10:28.519442464 WET
    [Time shift for this packet: 0.000000000 seconds]
    Epoch Time: 1509970228.519442464 seconds
    [Time delta from previous captured frame: 0.753882786 seconds]
    [Time delta from previous displayed frame: 0.753882786 seconds]
    [Time since reference or first frame: 0.753882786 seconds]
    Frame Number: 2
    Frame Length: 112 bytes (896 bits)
    Capture Length: 112 bytes (896 bits)
    [Frame is marked: False]
    [Frame is ignored: False]
    [Protocols in frame: eth:ethertype:ip:tcp:ssl]
    [Coloring Rule Name: TCP]
    [Coloring Rule String: tcp]
Ethernet II, Src: Pegatron_49:f9:c2 (00:71:c2:49:f9:c2), Dst: Vmware_1d:41:ec (00:0c:29:1d:41:ec)
Internet Protocol Version 4, Src: 192.168.73.201, Dst: 31.13.90.2
    0100 .... = Version: 4
    .... 0101 = Header Length: 20 bytes (5)
    Differentiated Services Field: 0x00 (DSCP: CS0, ECN: Not-ECT)
    Total Length: 98
    Identification: 0x2345 (9029)
    Flags: 0x02 (Don't Fragment)
    Fragment offset: 0
    Time to live: 64
    Protocol: TCP (6)
    Header checksum: 0x93d0 [validation disabled]
    [Header checksum status: Unverified]
    Source: 192.168.73.201
    Destination: 31.13.90.2
    [Source GeoIP: Unknown]
    [Destination GeoIP: Ireland]
Transmission Control Protocol, Src Port: 43582, Dst Port: 443, Seq: 1, Ack: 1, Len: 46
Secure Sockets Layer

No.     Time           Source                Destination           Protocol  
      3 0.753947067    192.168.73.201        31.13.90.36           TLSv1.2  Application Data

Frame 3: 112 bytes on wire (896 bits), 112 bytes captured (896 bits) on interface 0
    Interface id: 0 (enp4s0)
    Encapsulation type: Ethernet (1)
    Arrival Time: Nov  6, 2017 12:10:28.519506745 WET
    [Time shift for this packet: 0.000000000 seconds]
    Epoch Time: 1509970228.519506745 seconds
    [Time delta from previous captured frame: 0.000064281 seconds]
    [Time delta from previous displayed frame: 0.000064281 seconds]
    [Time since reference or first frame: 0.753947067 seconds]
    Frame Number: 3
    Frame Length: 112 bytes (896 bits)
    Capture Length: 112 bytes (896 bits)
    [Frame is marked: False]
    [Frame is ignored: False]
    [Protocols in frame: eth:ethertype:ip:tcp:ssl]
    [Coloring Rule Name: TCP]
    [Coloring Rule String: tcp]
Ethernet II, Src: Pegatron_49:f9:c2 (00:71:c2:49:f9:c2), Dst: Vmware_1d:41:ec (00:0c:29:1d:41:ec)
Internet Protocol Version 4, Src: 192.168.73.201, Dst: 31.13.90.36
    0100 .... = Version: 4
    .... 0101 = Header Length: 20 bytes (5)
    Differentiated Services Field: 0x00 (DSCP: CS0, ECN: Not-ECT)
    Total Length: 98
    Identification: 0x61ea (25066)
    Flags: 0x02 (Don't Fragment)
    Fragment offset: 0
    Time to live: 64
    Protocol: TCP (6)
    Header checksum: 0x5509 [validation disabled]
    [Header checksum status: Unverified]
    Source: 192.168.73.201
    Destination: 31.13.90.36
    [Source GeoIP: Unknown]
    [Destination GeoIP: Ireland]
Transmission Control Protocol, Src Port: 33160, Dst Port: 443, Seq: 1, Ack: 1, Len: 46
Secure Sockets Layer

No.     Time           Source                Destination           Protocol  
      4 0.798818387    31.13.90.2            192.168.73.201        TLSv1.2  Application Data

Frame 4: 112 bytes on wire (896 bits), 112 bytes captured (896 bits) on interface 0
    Interface id: 0 (enp4s0)
    Encapsulation type: Ethernet (1)
    Arrival Time: Nov  6, 2017 12:10:28.564378065 WET
    [Time shift for this packet: 0.000000000 seconds]
    Epoch Time: 1509970228.564378065 seconds
    [Time delta from previous captured frame: 0.044871320 seconds]
    [Time delta from previous displayed frame: 0.044871320 seconds]
    [Time since reference or first frame: 0.798818387 seconds]
    Frame Number: 4
    Frame Length: 112 bytes (896 bits)
    Capture Length: 112 bytes (896 bits)
    [Frame is marked: False]
    [Frame is ignored: False]
    [Protocols in frame: eth:ethertype:ip:tcp:ssl]
    [Coloring Rule Name: TCP]
    [Coloring Rule String: tcp]
Ethernet II, Src: Vmware_1d:41:ec (00:0c:29:1d:41:ec), Dst: Pegatron_49:f9:c2 (00:71:c2:49:f9:c2)
Internet Protocol Version 4, Src: 31.13.90.2, Dst: 192.168.73.201
    0100 .... = Version: 4
    .... 0101 = Header Length: 20 bytes (5)
    Differentiated Services Field: 0x00 (DSCP: CS0, ECN: Not-ECT)
    Total Length: 98
    Identification: 0xe719 (59161)
    Flags: 0x02 (Don't Fragment)
    Fragment offset: 0
    Time to live: 49
    Protocol: TCP (6)
    Header checksum: 0xdefb [validation disabled]
    [Header checksum status: Unverified]
    Source: 31.13.90.2
    Destination: 192.168.73.201
    [Source GeoIP: Ireland]
    [Destination GeoIP: Unknown]
Transmission Control Protocol, Src Port: 443, Dst Port: 43582, Seq: 1, Ack: 47, Len: 46
Secure Sockets Layer

No.     Time           Source                Destination           Protocol  
      5 0.798867384    192.168.73.201        31.13.90.2            TCP      43582 → 443 [ACK] Seq=47 Ack=47 Win=1444 Len=0 TSval=528668394 TSecr=2334269663

Frame 5: 66 bytes on wire (528 bits), 66 bytes captured (528 bits) on interface 0
    Interface id: 0 (enp4s0)
    Encapsulation type: Ethernet (1)
    Arrival Time: Nov  6, 2017 12:10:28.564427062 WET
    [Time shift for this packet: 0.000000000 seconds]
    Epoch Time: 1509970228.564427062 seconds
    [Time delta from previous captured frame: 0.000048997 seconds]
    [Time delta from previous displayed frame: 0.000048997 seconds]
    [Time since reference or first frame: 0.798867384 seconds]
    Frame Number: 5
    Frame Length: 66 bytes (528 bits)
    Capture Length: 66 bytes (528 bits)
    [Frame is marked: False]
    [Frame is ignored: False]
    [Protocols in frame: eth:ethertype:ip:tcp]
    [Coloring Rule Name: TCP]
    [Coloring Rule String: tcp]
Ethernet II, Src: Pegatron_49:f9:c2 (00:71:c2:49:f9:c2), Dst: Vmware_1d:41:ec (00:0c:29:1d:41:ec)
Internet Protocol Version 4, Src: 192.168.73.201, Dst: 31.13.90.2
    0100 .... = Version: 4
    .... 0101 = Header Length: 20 bytes (5)
    Differentiated Services Field: 0x00 (DSCP: CS0, ECN: Not-ECT)
    Total Length: 52
    Identification: 0x2346 (9030)
    Flags: 0x02 (Don't Fragment)
    Fragment offset: 0
    Time to live: 64
    Protocol: TCP (6)
    Header checksum: 0x93fd [validation disabled]
    [Header checksum status: Unverified]
    Source: 192.168.73.201
    Destination: 31.13.90.2
    [Source GeoIP: Unknown]
    [Destination GeoIP: Ireland]
Transmission Control Protocol, Src Port: 43582, Dst Port: 443, Seq: 47, Ack: 47, Len: 0

No.     Time           Source                Destination           Protocol  
      6 0.798885558    31.13.90.36           192.168.73.201        TLSv1.2  Application Data

Frame 6: 112 bytes on wire (896 bits), 112 bytes captured (896 bits) on interface 0
    Interface id: 0 (enp4s0)
    Encapsulation type: Ethernet (1)
    Arrival Time: Nov  6, 2017 12:10:28.564445236 WET
    [Time shift for this packet: 0.000000000 seconds]
    Epoch Time: 1509970228.564445236 seconds
    [Time delta from previous captured frame: 0.000018174 seconds]
    [Time delta from previous displayed frame: 0.000018174 seconds]
    [Time since reference or first frame: 0.798885558 seconds]
    Frame Number: 6
    Frame Length: 112 bytes (896 bits)
    Capture Length: 112 bytes (896 bits)
    [Frame is marked: False]
    [Frame is ignored: False]
    [Protocols in frame: eth:ethertype:ip:tcp:ssl]
    [Coloring Rule Name: TCP]
    [Coloring Rule String: tcp]
Ethernet II, Src: Vmware_1d:41:ec (00:0c:29:1d:41:ec), Dst: Pegatron_49:f9:c2 (00:71:c2:49:f9:c2)
Internet Protocol Version 4, Src: 31.13.90.36, Dst: 192.168.73.201
    0100 .... = Version: 4
    .... 0101 = Header Length: 20 bytes (5)
    Differentiated Services Field: 0x00 (DSCP: CS0, ECN: Not-ECT)
    Total Length: 98
    Identification: 0x80e7 (32999)
    Flags: 0x02 (Don't Fragment)
    Fragment offset: 0
    Time to live: 49
    Protocol: TCP (6)
    Header checksum: 0x450c [validation disabled]
    [Header checksum status: Unverified]
    Source: 31.13.90.36
    Destination: 192.168.73.201
    [Source GeoIP: Ireland]
    [Destination GeoIP: Unknown]
Transmission Control Protocol, Src Port: 443, Dst Port: 33160, Seq: 1, Ack: 47, Len: 46
Secure Sockets Layer

No.     Time           Source                Destination           Protocol  
      7 0.798896095    192.168.73.201        31.13.90.36           TCP      33160 → 443 [ACK] Seq=47 Ack=47 Win=2777 Len=0 TSval=2381713374 TSecr=3018166664

Frame 7: 66 bytes on wire (528 bits), 66 bytes captured (528 bits) on interface 0
    Interface id: 0 (enp4s0)
    Encapsulation type: Ethernet (1)
    Arrival Time: Nov  6, 2017 12:10:28.564455773 WET
    [Time shift for this packet: 0.000000000 seconds]
    Epoch Time: 1509970228.564455773 seconds
    [Time delta from previous captured frame: 0.000010537 seconds]
    [Time delta from previous displayed frame: 0.000010537 seconds]
    [Time since reference or first frame: 0.798896095 seconds]
    Frame Number: 7
    Frame Length: 66 bytes (528 bits)
    Capture Length: 66 bytes (528 bits)
    [Frame is marked: False]
    [Frame is ignored: False]
    [Protocols in frame: eth:ethertype:ip:tcp]
    [Coloring Rule Name: TCP]
    [Coloring Rule String: tcp]
Ethernet II, Src: Pegatron_49:f9:c2 (00:71:c2:49:f9:c2), Dst: Vmware_1d:41:ec (00:0c:29:1d:41:ec)
Internet Protocol Version 4, Src: 192.168.73.201, Dst: 31.13.90.36
    0100 .... = Version: 4
    .... 0101 = Header Length: 20 bytes (5)
    Differentiated Services Field: 0x00 (DSCP: CS0, ECN: Not-ECT)
    Total Length: 52
    Identification: 0x61eb (25067)
    Flags: 0x02 (Don't Fragment)
    Fragment offset: 0
    Time to live: 64
    Protocol: TCP (6)
    Header checksum: 0x5536 [validation disabled]
    [Header checksum status: Unverified]
    Source: 192.168.73.201
    Destination: 31.13.90.36
    [Source GeoIP: Unknown]
    [Destination GeoIP: Ireland]
Transmission Control Protocol, Src Port: 33160, Dst Port: 443, Seq: 47, Ack: 47, Len: 0

No.     Time           Source                Destination           Protocol  
      8 1.026099706    192.168.73.201        52.31.222.237         TLSv1.2  Application Data

Frame 8: 129 bytes on wire (1032 bits), 129 bytes captured (1032 bits) on interface 0
    Interface id: 0 (enp4s0)
    Encapsulation type: Ethernet (1)
    Arrival Time: Nov  6, 2017 12:10:28.791659384 WET
    [Time shift for this packet: 0.000000000 seconds]
    Epoch Time: 1509970228.791659384 seconds
    [Time delta from previous captured frame: 0.227203611 seconds]
    [Time delta from previous displayed frame: 0.227203611 seconds]
    [Time since reference or first frame: 1.026099706 seconds]
    Frame Number: 8
    Frame Length: 129 bytes (1032 bits)
    Capture Length: 129 bytes (1032 bits)
    [Frame is marked: False]
    [Frame is ignored: False]
    [Protocols in frame: eth:ethertype:ip:tcp:ssl]
    [Coloring Rule Name: TCP]
    [Coloring Rule String: tcp]
Ethernet II, Src: Pegatron_49:f9:c2 (00:71:c2:49:f9:c2), Dst: Vmware_1d:41:ec (00:0c:29:1d:41:ec)
Internet Protocol Version 4, Src: 192.168.73.201, Dst: 52.31.222.237
    0100 .... = Version: 4
    .... 0101 = Header Length: 20 bytes (5)
    Differentiated Services Field: 0x00 (DSCP: CS0, ECN: Not-ECT)
    Total Length: 115
    Identification: 0x03fc (1020)
    Flags: 0x02 (Don't Fragment)
    Fragment offset: 0
    Time to live: 64
    Protocol: TCP (6)
    Header checksum: 0x190b [validation disabled]
    [Header checksum status: Unverified]
    Source: 192.168.73.201
    Destination: 52.31.222.237
    [Source GeoIP: Unknown]
    [Destination GeoIP: Ireland]
Transmission Control Protocol, Src Port: 46338, Dst Port: 443, Seq: 1, Ack: 1, Len: 63
Secure Sockets Layer

No.     Time           Source                Destination           Protocol  
      9 1.081353444    52.31.222.237         192.168.73.201        TCP      443 → 46338 [ACK] Seq=1 Ack=64 Win=974 Len=0 TSval=835371359 TSecr=1144093765

Frame 9: 66 bytes on wire (528 bits), 66 bytes captured (528 bits) on interface 0
    Interface id: 0 (enp4s0)
    Encapsulation type: Ethernet (1)
    Arrival Time: Nov  6, 2017 12:10:28.846913122 WET
    [Time shift for this packet: 0.000000000 seconds]
    Epoch Time: 1509970228.846913122 seconds
    [Time delta from previous captured frame: 0.055253738 seconds]
    [Time delta from previous displayed frame: 0.055253738 seconds]
    [Time since reference or first frame: 1.081353444 seconds]
    Frame Number: 9
    Frame Length: 66 bytes (528 bits)
    Capture Length: 66 bytes (528 bits)
    [Frame is marked: False]
    [Frame is ignored: False]
    [Protocols in frame: eth:ethertype:ip:tcp]
    [Coloring Rule Name: TCP]
    [Coloring Rule String: tcp]
Ethernet II, Src: Vmware_1d:41:ec (00:0c:29:1d:41:ec), Dst: Pegatron_49:f9:c2 (00:71:c2:49:f9:c2)
Internet Protocol Version 4, Src: 52.31.222.237, Dst: 192.168.73.201
    0100 .... = Version: 4
    .... 0101 = Header Length: 20 bytes (5)
    Differentiated Services Field: 0x00 (DSCP: CS0, ECN: Not-ECT)
    Total Length: 52
    Identification: 0xf1b7 (61879)
    Flags: 0x02 (Don't Fragment)
    Fragment offset: 0
    Time to live: 43
    Protocol: TCP (6)
    Header checksum: 0x408e [validation disabled]
    [Header checksum status: Unverified]
    Source: 52.31.222.237
    Destination: 192.168.73.201
    [Source GeoIP: Ireland]
    [Destination GeoIP: Unknown]
Transmission Control Protocol, Src Port: 443, Dst Port: 46338, Seq: 1, Ack: 64, Len: 0

No.     Time           Source                Destination           Protocol  
     10 1.158648134    52.31.222.237         192.168.73.201        TLSv1.2  Application Data

Frame 10: 129 bytes on wire (1032 bits), 129 bytes captured (1032 bits) on interface 0
    Interface id: 0 (enp4s0)
    Encapsulation type: Ethernet (1)
    Arrival Time: Nov  6, 2017 12:10:28.924207812 WET
    [Time shift for this packet: 0.000000000 seconds]
    Epoch Time: 1509970228.924207812 seconds
    [Time delta from previous captured frame: 0.077294690 seconds]
    [Time delta from previous displayed frame: 0.077294690 seconds]
    [Time since reference or first frame: 1.158648134 seconds]
    Frame Number: 10
    Frame Length: 129 bytes (1032 bits)
    Capture Length: 129 bytes (1032 bits)
    [Frame is marked: False]
    [Frame is ignored: False]
    [Protocols in frame: eth:ethertype:ip:tcp:ssl]
    [Coloring Rule Name: TCP]
    [Coloring Rule String: tcp]
Ethernet II, Src: Vmware_1d:41:ec (00:0c:29:1d:41:ec), Dst: Pegatron_49:f9:c2 (00:71:c2:49:f9:c2)
Internet Protocol Version 4, Src: 52.31.222.237, Dst: 192.168.73.201
    0100 .... = Version: 4
    .... 0101 = Header Length: 20 bytes (5)
    Differentiated Services Field: 0x00 (DSCP: CS0, ECN: Not-ECT)
    Total Length: 115
    Identification: 0xf1b8 (61880)
    Flags: 0x02 (Don't Fragment)
    Fragment offset: 0
    Time to live: 43
    Protocol: TCP (6)
    Header checksum: 0x404e [validation disabled]
    [Header checksum status: Unverified]
    Source: 52.31.222.237
    Destination: 192.168.73.201
    [Source GeoIP: Ireland]
    [Destination GeoIP: Unknown]
Transmission Control Protocol, Src Port: 443, Dst Port: 46338, Seq: 1, Ack: 64, Len: 63
Secure Sockets Layer

No.     Time           Source                Destination           Protocol  
     11 1.158699027    192.168.73.201        52.31.222.237         TCP      46338 → 443 [ACK] Seq=64 Ack=64 Win=1075 Len=0 TSval=1144093898 TSecr=835371378

Frame 11: 66 bytes on wire (528 bits), 66 bytes captured (528 bits) on interface 0
    Interface id: 0 (enp4s0)
    Encapsulation type: Ethernet (1)
    Arrival Time: Nov  6, 2017 12:10:28.924258705 WET
    [Time shift for this packet: 0.000000000 seconds]
    Epoch Time: 1509970228.924258705 seconds
    [Time delta from previous captured frame: 0.000050893 seconds]
    [Time delta from previous displayed frame: 0.000050893 seconds]
    [Time since reference or first frame: 1.158699027 seconds]
    Frame Number: 11
    Frame Length: 66 bytes (528 bits)
    Capture Length: 66 bytes (528 bits)
    [Frame is marked: False]
    [Frame is ignored: False]
    [Protocols in frame: eth:ethertype:ip:tcp]
    [Coloring Rule Name: TCP]
    [Coloring Rule String: tcp]
Ethernet II, Src: Pegatron_49:f9:c2 (00:71:c2:49:f9:c2), Dst: Vmware_1d:41:ec (00:0c:29:1d:41:ec)
Internet Protocol Version 4, Src: 192.168.73.201, Dst: 52.31.222.237
    0100 .... = Version: 4
    .... 0101 = Header Length: 20 bytes (5)
    Differentiated Services Field: 0x00 (DSCP: CS0, ECN: Not-ECT)
    Total Length: 52
    Identification: 0x03fd (1021)
    Flags: 0x02 (Don't Fragment)
    Fragment offset: 0
    Time to live: 64
    Protocol: TCP (6)
    Header checksum: 0x1949 [validation disabled]
    [Header checksum status: Unverified]
    Source: 192.168.73.201
    Destination: 52.31.222.237
    [Source GeoIP: Unknown]
    [Destination GeoIP: Ireland]
Transmission Control Protocol, Src Port: 46338, Dst Port: 443, Seq: 64, Ack: 64, Len: 0

No.     Time           Source                Destination           Protocol  
     12 1.250003448    192.168.73.201        193.136.19.1          DNS      Standard query 0xd8e5 A router-di.uminho.pt

Frame 12: 79 bytes on wire (632 bits), 79 bytes captured (632 bits) on interface 0
    Interface id: 0 (enp4s0)
    Encapsulation type: Ethernet (1)
    Arrival Time: Nov  6, 2017 12:10:29.015563126 WET
    [Time shift for this packet: 0.000000000 seconds]
    Epoch Time: 1509970229.015563126 seconds
    [Time delta from previous captured frame: 0.091304421 seconds]
    [Time delta from previous displayed frame: 0.091304421 seconds]
    [Time since reference or first frame: 1.250003448 seconds]
    Frame Number: 12
    Frame Length: 79 bytes (632 bits)
    Capture Length: 79 bytes (632 bits)
    [Frame is marked: False]
    [Frame is ignored: False]
    [Protocols in frame: eth:ethertype:ip:udp:dns]
    [Coloring Rule Name: UDP]
    [Coloring Rule String: udp]
Ethernet II, Src: Pegatron_49:f9:c2 (00:71:c2:49:f9:c2), Dst: Vmware_1d:41:ec (00:0c:29:1d:41:ec)
Internet Protocol Version 4, Src: 192.168.73.201, Dst: 193.136.19.1
    0100 .... = Version: 4
    .... 0101 = Header Length: 20 bytes (5)
    Differentiated Services Field: 0x00 (DSCP: CS0, ECN: Not-ECT)
    Total Length: 65
    Identification: 0x3e3c (15932)
    Flags: 0x02 (Don't Fragment)
    Fragment offset: 0
    Time to live: 64
    Protocol: UDP (17)
    Header checksum: 0x1d75 [validation disabled]
    [Header checksum status: Unverified]
    Source: 192.168.73.201
    Destination: 193.136.19.1
    [Source GeoIP: Unknown]
    [Destination GeoIP: Portugal]
User Datagram Protocol, Src Port: 36612, Dst Port: 53
Domain Name System (query)

No.     Time           Source                Destination           Protocol  
     13 1.250008472    192.168.73.201        193.136.19.1          DNS      Standard query 0x74ed AAAA router-di.uminho.pt

Frame 13: 79 bytes on wire (632 bits), 79 bytes captured (632 bits) on interface 0
    Interface id: 0 (enp4s0)
    Encapsulation type: Ethernet (1)
    Arrival Time: Nov  6, 2017 12:10:29.015568150 WET
    [Time shift for this packet: 0.000000000 seconds]
    Epoch Time: 1509970229.015568150 seconds
    [Time delta from previous captured frame: 0.000005024 seconds]
    [Time delta from previous displayed frame: 0.000005024 seconds]
    [Time since reference or first frame: 1.250008472 seconds]
    Frame Number: 13
    Frame Length: 79 bytes (632 bits)
    Capture Length: 79 bytes (632 bits)
    [Frame is marked: False]
    [Frame is ignored: False]
    [Protocols in frame: eth:ethertype:ip:udp:dns]
    [Coloring Rule Name: UDP]
    [Coloring Rule String: udp]
Ethernet II, Src: Pegatron_49:f9:c2 (00:71:c2:49:f9:c2), Dst: Vmware_1d:41:ec (00:0c:29:1d:41:ec)
Internet Protocol Version 4, Src: 192.168.73.201, Dst: 193.136.19.1
    0100 .... = Version: 4
    .... 0101 = Header Length: 20 bytes (5)
    Differentiated Services Field: 0x00 (DSCP: CS0, ECN: Not-ECT)
    Total Length: 65
    Identification: 0x3e3d (15933)
    Flags: 0x02 (Don't Fragment)
    Fragment offset: 0
    Time to live: 64
    Protocol: UDP (17)
    Header checksum: 0x1d74 [validation disabled]
    [Header checksum status: Unverified]
    Source: 192.168.73.201
    Destination: 193.136.19.1
    [Source GeoIP: Unknown]
    [Destination GeoIP: Portugal]
User Datagram Protocol, Src Port: 36612, Dst Port: 53
Domain Name System (query)

No.     Time           Source                Destination           Protocol  
     14 1.252342210    193.136.19.1          192.168.73.201        DNS      Standard query response 0xd8e5 A router-di.uminho.pt A 193.136.9.254 NS dns3.uminho.pt NS dns2.uminho.pt NS ns02.fccn.pt NS dns.uminho.pt A 193.137.16.75 A 193.137.16.145 A 193.137.16.65 A 193.136.2.228 AAAA 2001:690:2280:1::75 AAAA 2001:690:2280:801::145 AAAA 2001:690:2280:1::65 AAAA 2001:690:a80:4001::200

Frame 14: 351 bytes on wire (2808 bits), 351 bytes captured (2808 bits) on interface 0
    Interface id: 0 (enp4s0)
    Encapsulation type: Ethernet (1)
    Arrival Time: Nov  6, 2017 12:10:29.017901888 WET
    [Time shift for this packet: 0.000000000 seconds]
    Epoch Time: 1509970229.017901888 seconds
    [Time delta from previous captured frame: 0.002333738 seconds]
    [Time delta from previous displayed frame: 0.002333738 seconds]
    [Time since reference or first frame: 1.252342210 seconds]
    Frame Number: 14
    Frame Length: 351 bytes (2808 bits)
    Capture Length: 351 bytes (2808 bits)
    [Frame is marked: False]
    [Frame is ignored: False]
    [Protocols in frame: eth:ethertype:ip:udp:dns]
    [Coloring Rule Name: UDP]
    [Coloring Rule String: udp]
Ethernet II, Src: Vmware_1d:41:ec (00:0c:29:1d:41:ec), Dst: Pegatron_49:f9:c2 (00:71:c2:49:f9:c2)
Internet Protocol Version 4, Src: 193.136.19.1, Dst: 192.168.73.201
    0100 .... = Version: 4
    .... 0101 = Header Length: 20 bytes (5)
    Differentiated Services Field: 0x00 (DSCP: CS0, ECN: Not-ECT)
    Total Length: 337
    Identification: 0x170e (5902)
    Flags: 0x00
    Fragment offset: 0
    Time to live: 63
    Protocol: UDP (17)
    Header checksum: 0x8493 [validation disabled]
    [Header checksum status: Unverified]
    Source: 193.136.19.1
    Destination: 192.168.73.201
    [Source GeoIP: Portugal]
    [Destination GeoIP: Unknown]
User Datagram Protocol, Src Port: 53, Dst Port: 36612
Domain Name System (response)

No.     Time           Source                Destination           Protocol  
     15 1.252638515    193.136.19.1          192.168.73.201        DNS      Standard query response 0x74ed AAAA router-di.uminho.pt SOA dns.uminho.pt

Frame 15: 133 bytes on wire (1064 bits), 133 bytes captured (1064 bits) on interface 0
    Interface id: 0 (enp4s0)
    Encapsulation type: Ethernet (1)
    Arrival Time: Nov  6, 2017 12:10:29.018198193 WET
    [Time shift for this packet: 0.000000000 seconds]
    Epoch Time: 1509970229.018198193 seconds
    [Time delta from previous captured frame: 0.000296305 seconds]
    [Time delta from previous displayed frame: 0.000296305 seconds]
    [Time since reference or first frame: 1.252638515 seconds]
    Frame Number: 15
    Frame Length: 133 bytes (1064 bits)
    Capture Length: 133 bytes (1064 bits)
    [Frame is marked: False]
    [Frame is ignored: False]
    [Protocols in frame: eth:ethertype:ip:udp:dns]
    [Coloring Rule Name: UDP]
    [Coloring Rule String: udp]
Ethernet II, Src: Vmware_1d:41:ec (00:0c:29:1d:41:ec), Dst: Pegatron_49:f9:c2 (00:71:c2:49:f9:c2)
Internet Protocol Version 4, Src: 193.136.19.1, Dst: 192.168.73.201
    0100 .... = Version: 4
    .... 0101 = Header Length: 20 bytes (5)
    Differentiated Services Field: 0x00 (DSCP: CS0, ECN: Not-ECT)
    Total Length: 119
    Identification: 0x170f (5903)
    Flags: 0x00
    Fragment offset: 0
    Time to live: 63
    Protocol: UDP (17)
    Header checksum: 0x856c [validation disabled]
    [Header checksum status: Unverified]
    Source: 193.136.19.1
    Destination: 192.168.73.201
    [Source GeoIP: Portugal]
    [Destination GeoIP: Unknown]
User Datagram Protocol, Src Port: 53, Dst Port: 36612
Domain Name System (response)

No.     Time           Source                Destination           Protocol  
     16 1.252772631    192.168.73.201        193.136.9.254         IPv4     Fragmented IP protocol (proto=ICMP 1, off=0, ID=cce5) [Reassembled in #18]

Frame 16: 1514 bytes on wire (12112 bits), 1514 bytes captured (12112 bits) on interface 0
    Interface id: 0 (enp4s0)
    Encapsulation type: Ethernet (1)
    Arrival Time: Nov  6, 2017 12:10:29.018332309 WET
    [Time shift for this packet: 0.000000000 seconds]
    Epoch Time: 1509970229.018332309 seconds
    [Time delta from previous captured frame: 0.000134116 seconds]
    [Time delta from previous displayed frame: 0.000134116 seconds]
    [Time since reference or first frame: 1.252772631 seconds]
    Frame Number: 16
    Frame Length: 1514 bytes (12112 bits)
    Capture Length: 1514 bytes (12112 bits)
    [Frame is marked: False]
    [Frame is ignored: False]
    [Protocols in frame: eth:ethertype:ip:data]
    [Coloring Rule Name: TTL low or unexpected]
    [Coloring Rule String: ( ! ip.dst == 224.0.0.0/4 && ip.ttl < 5 && !pim && !ospf) || (ip.dst == 224.0.0.0/24 && ip.dst != 224.0.0.251 && ip.ttl != 1 && !(vrrp || carp))]
Ethernet II, Src: Pegatron_49:f9:c2 (00:71:c2:49:f9:c2), Dst: Vmware_1d:41:ec (00:0c:29:1d:41:ec)
Internet Protocol Version 4, Src: 192.168.73.201, Dst: 193.136.9.254
    0100 .... = Version: 4
    .... 0101 = Header Length: 20 bytes (5)
    Differentiated Services Field: 0x00 (DSCP: CS0, ECN: Not-ECT)
    Total Length: 1500
    Identification: 0xcce5 (52453)
    Flags: 0x01 (More Fragments)
    Fragment offset: 0
    Time to live: 1
    Protocol: ICMP (1)
    Header checksum: 0xf143 [validation disabled]
    [Header checksum status: Unverified]
    Source: 192.168.73.201
    Destination: 193.136.9.254
    [Source GeoIP: Unknown]
    [Destination GeoIP: Portugal]
    Reassembled IPv4 in frame: 18
Data (1480 bytes)

0000  08 00 5e f2 20 2f 00 01 48 49 4a 4b 4c 4d 4e 4f   ..^. /..HIJKLMNO
0010  50 51 52 53 54 55 56 57 58 59 5a 5b 5c 5d 5e 5f   PQRSTUVWXYZ[\]^_
0020  60 61 62 63 64 65 66 67 68 69 6a 6b 6c 6d 6e 6f   `abcdefghijklmno
0030  70 71 72 73 74 75 76 77 78 79 7a 7b 7c 7d 7e 7f   pqrstuvwxyz{|}~.
0040  40 41 42 43 44 45 46 47 48 49 4a 4b 4c 4d 4e 4f   @ABCDEFGHIJKLMNO
0050  50 51 52 53 54 55 56 57 58 59 5a 5b 5c 5d 5e 5f   PQRSTUVWXYZ[\]^_
0060  60 61 62 63 64 65 66 67 68 69 6a 6b 6c 6d 6e 6f   `abcdefghijklmno
0070  70 71 72 73 74 75 76 77 78 79 7a 7b 7c 7d 7e 7f   pqrstuvwxyz{|}~.
0080  40 41 42 43 44 45 46 47 48 49 4a 4b 4c 4d 4e 4f   @ABCDEFGHIJKLMNO
0090  50 51 52 53 54 55 56 57 58 59 5a 5b 5c 5d 5e 5f   PQRSTUVWXYZ[\]^_
00a0  60 61 62 63 64 65 66 67 68 69 6a 6b 6c 6d 6e 6f   `abcdefghijklmno
00b0  70 71 72 73 74 75 76 77 78 79 7a 7b 7c 7d 7e 7f   pqrstuvwxyz{|}~.
00c0  40 41 42 43 44 45 46 47 48 49 4a 4b 4c 4d 4e 4f   @ABCDEFGHIJKLMNO
00d0  50 51 52 53 54 55 56 57 58 59 5a 5b 5c 5d 5e 5f   PQRSTUVWXYZ[\]^_
00e0  60 61 62 63 64 65 66 67 68 69 6a 6b 6c 6d 6e 6f   `abcdefghijklmno
00f0  70 71 72 73 74 75 76 77 78 79 7a 7b 7c 7d 7e 7f   pqrstuvwxyz{|}~.
0100  40 41 42 43 44 45 46 47 48 49 4a 4b 4c 4d 4e 4f   @ABCDEFGHIJKLMNO
0110  50 51 52 53 54 55 56 57 58 59 5a 5b 5c 5d 5e 5f   PQRSTUVWXYZ[\]^_
0120  60 61 62 63 64 65 66 67 68 69 6a 6b 6c 6d 6e 6f   `abcdefghijklmno
0130  70 71 72 73 74 75 76 77 78 79 7a 7b 7c 7d 7e 7f   pqrstuvwxyz{|}~.
0140  40 41 42 43 44 45 46 47 48 49 4a 4b 4c 4d 4e 4f   @ABCDEFGHIJKLMNO
0150  50 51 52 53 54 55 56 57 58 59 5a 5b 5c 5d 5e 5f   PQRSTUVWXYZ[\]^_
0160  60 61 62 63 64 65 66 67 68 69 6a 6b 6c 6d 6e 6f   `abcdefghijklmno
0170  70 71 72 73 74 75 76 77 78 79 7a 7b 7c 7d 7e 7f   pqrstuvwxyz{|}~.
0180  40 41 42 43 44 45 46 47 48 49 4a 4b 4c 4d 4e 4f   @ABCDEFGHIJKLMNO
0190  50 51 52 53 54 55 56 57 58 59 5a 5b 5c 5d 5e 5f   PQRSTUVWXYZ[\]^_
01a0  60 61 62 63 64 65 66 67 68 69 6a 6b 6c 6d 6e 6f   `abcdefghijklmno
01b0  70 71 72 73 74 75 76 77 78 79 7a 7b 7c 7d 7e 7f   pqrstuvwxyz{|}~.
01c0  40 41 42 43 44 45 46 47 48 49 4a 4b 4c 4d 4e 4f   @ABCDEFGHIJKLMNO
01d0  50 51 52 53 54 55 56 57 58 59 5a 5b 5c 5d 5e 5f   PQRSTUVWXYZ[\]^_
01e0  60 61 62 63 64 65 66 67 68 69 6a 6b 6c 6d 6e 6f   `abcdefghijklmno
01f0  70 71 72 73 74 75 76 77 78 79 7a 7b 7c 7d 7e 7f   pqrstuvwxyz{|}~.
0200  40 41 42 43 44 45 46 47 48 49 4a 4b 4c 4d 4e 4f   @ABCDEFGHIJKLMNO
0210  50 51 52 53 54 55 56 57 58 59 5a 5b 5c 5d 5e 5f   PQRSTUVWXYZ[\]^_
0220  60 61 62 63 64 65 66 67 68 69 6a 6b 6c 6d 6e 6f   `abcdefghijklmno
0230  70 71 72 73 74 75 76 77 78 79 7a 7b 7c 7d 7e 7f   pqrstuvwxyz{|}~.
0240  40 41 42 43 44 45 46 47 48 49 4a 4b 4c 4d 4e 4f   @ABCDEFGHIJKLMNO
0250  50 51 52 53 54 55 56 57 58 59 5a 5b 5c 5d 5e 5f   PQRSTUVWXYZ[\]^_
0260  60 61 62 63 64 65 66 67 68 69 6a 6b 6c 6d 6e 6f   `abcdefghijklmno
0270  70 71 72 73 74 75 76 77 78 79 7a 7b 7c 7d 7e 7f   pqrstuvwxyz{|}~.
0280  40 41 42 43 44 45 46 47 48 49 4a 4b 4c 4d 4e 4f   @ABCDEFGHIJKLMNO
0290  50 51 52 53 54 55 56 57 58 59 5a 5b 5c 5d 5e 5f   PQRSTUVWXYZ[\]^_
02a0  60 61 62 63 64 65 66 67 68 69 6a 6b 6c 6d 6e 6f   `abcdefghijklmno
02b0  70 71 72 73 74 75 76 77 78 79 7a 7b 7c 7d 7e 7f   pqrstuvwxyz{|}~.
02c0  40 41 42 43 44 45 46 47 48 49 4a 4b 4c 4d 4e 4f   @ABCDEFGHIJKLMNO
02d0  50 51 52 53 54 55 56 57 58 59 5a 5b 5c 5d 5e 5f   PQRSTUVWXYZ[\]^_
02e0  60 61 62 63 64 65 66 67 68 69 6a 6b 6c 6d 6e 6f   `abcdefghijklmno
02f0  70 71 72 73 74 75 76 77 78 79 7a 7b 7c 7d 7e 7f   pqrstuvwxyz{|}~.
0300  40 41 42 43 44 45 46 47 48 49 4a 4b 4c 4d 4e 4f   @ABCDEFGHIJKLMNO
0310  50 51 52 53 54 55 56 57 58 59 5a 5b 5c 5d 5e 5f   PQRSTUVWXYZ[\]^_
0320  60 61 62 63 64 65 66 67 68 69 6a 6b 6c 6d 6e 6f   `abcdefghijklmno
0330  70 71 72 73 74 75 76 77 78 79 7a 7b 7c 7d 7e 7f   pqrstuvwxyz{|}~.
0340  40 41 42 43 44 45 46 47 48 49 4a 4b 4c 4d 4e 4f   @ABCDEFGHIJKLMNO
0350  50 51 52 53 54 55 56 57 58 59 5a 5b 5c 5d 5e 5f   PQRSTUVWXYZ[\]^_
0360  60 61 62 63 64 65 66 67 68 69 6a 6b 6c 6d 6e 6f   `abcdefghijklmno
0370  70 71 72 73 74 75 76 77 78 79 7a 7b 7c 7d 7e 7f   pqrstuvwxyz{|}~.
0380  40 41 42 43 44 45 46 47 48 49 4a 4b 4c 4d 4e 4f   @ABCDEFGHIJKLMNO
0390  50 51 52 53 54 55 56 57 58 59 5a 5b 5c 5d 5e 5f   PQRSTUVWXYZ[\]^_
03a0  60 61 62 63 64 65 66 67 68 69 6a 6b 6c 6d 6e 6f   `abcdefghijklmno
03b0  70 71 72 73 74 75 76 77 78 79 7a 7b 7c 7d 7e 7f   pqrstuvwxyz{|}~.
03c0  40 41 42 43 44 45 46 47 48 49 4a 4b 4c 4d 4e 4f   @ABCDEFGHIJKLMNO
03d0  50 51 52 53 54 55 56 57 58 59 5a 5b 5c 5d 5e 5f   PQRSTUVWXYZ[\]^_
03e0  60 61 62 63 64 65 66 67 68 69 6a 6b 6c 6d 6e 6f   `abcdefghijklmno
03f0  70 71 72 73 74 75 76 77 78 79 7a 7b 7c 7d 7e 7f   pqrstuvwxyz{|}~.
0400  40 41 42 43 44 45 46 47 48 49 4a 4b 4c 4d 4e 4f   @ABCDEFGHIJKLMNO
0410  50 51 52 53 54 55 56 57 58 59 5a 5b 5c 5d 5e 5f   PQRSTUVWXYZ[\]^_
0420  60 61 62 63 64 65 66 67 68 69 6a 6b 6c 6d 6e 6f   `abcdefghijklmno
0430  70 71 72 73 74 75 76 77 78 79 7a 7b 7c 7d 7e 7f   pqrstuvwxyz{|}~.
0440  40 41 42 43 44 45 46 47 48 49 4a 4b 4c 4d 4e 4f   @ABCDEFGHIJKLMNO
0450  50 51 52 53 54 55 56 57 58 59 5a 5b 5c 5d 5e 5f   PQRSTUVWXYZ[\]^_
0460  60 61 62 63 64 65 66 67 68 69 6a 6b 6c 6d 6e 6f   `abcdefghijklmno
0470  70 71 72 73 74 75 76 77 78 79 7a 7b 7c 7d 7e 7f   pqrstuvwxyz{|}~.
0480  40 41 42 43 44 45 46 47 48 49 4a 4b 4c 4d 4e 4f   @ABCDEFGHIJKLMNO
0490  50 51 52 53 54 55 56 57 58 59 5a 5b 5c 5d 5e 5f   PQRSTUVWXYZ[\]^_
04a0  60 61 62 63 64 65 66 67 68 69 6a 6b 6c 6d 6e 6f   `abcdefghijklmno
04b0  70 71 72 73 74 75 76 77 78 79 7a 7b 7c 7d 7e 7f   pqrstuvwxyz{|}~.
04c0  40 41 42 43 44 45 46 47 48 49 4a 4b 4c 4d 4e 4f   @ABCDEFGHIJKLMNO
04d0  50 51 52 53 54 55 56 57 58 59 5a 5b 5c 5d 5e 5f   PQRSTUVWXYZ[\]^_
04e0  60 61 62 63 64 65 66 67 68 69 6a 6b 6c 6d 6e 6f   `abcdefghijklmno
04f0  70 71 72 73 74 75 76 77 78 79 7a 7b 7c 7d 7e 7f   pqrstuvwxyz{|}~.
0500  40 41 42 43 44 45 46 47 48 49 4a 4b 4c 4d 4e 4f   @ABCDEFGHIJKLMNO
0510  50 51 52 53 54 55 56 57 58 59 5a 5b 5c 5d 5e 5f   PQRSTUVWXYZ[\]^_
0520  60 61 62 63 64 65 66 67 68 69 6a 6b 6c 6d 6e 6f   `abcdefghijklmno
0530  70 71 72 73 74 75 76 77 78 79 7a 7b 7c 7d 7e 7f   pqrstuvwxyz{|}~.
0540  40 41 42 43 44 45 46 47 48 49 4a 4b 4c 4d 4e 4f   @ABCDEFGHIJKLMNO
0550  50 51 52 53 54 55 56 57 58 59 5a 5b 5c 5d 5e 5f   PQRSTUVWXYZ[\]^_
0560  60 61 62 63 64 65 66 67 68 69 6a 6b 6c 6d 6e 6f   `abcdefghijklmno
0570  70 71 72 73 74 75 76 77 78 79 7a 7b 7c 7d 7e 7f   pqrstuvwxyz{|}~.
0580  40 41 42 43 44 45 46 47 48 49 4a 4b 4c 4d 4e 4f   @ABCDEFGHIJKLMNO
0590  50 51 52 53 54 55 56 57 58 59 5a 5b 5c 5d 5e 5f   PQRSTUVWXYZ[\]^_
05a0  60 61 62 63 64 65 66 67 68 69 6a 6b 6c 6d 6e 6f   `abcdefghijklmno
05b0  70 71 72 73 74 75 76 77 78 79 7a 7b 7c 7d 7e 7f   pqrstuvwxyz{|}~.
05c0  40 41 42 43 44 45 46 47                           @ABCDEFG

No.     Time           Source                Destination           Protocol  
     17 1.252774990    192.168.73.201        193.136.9.254         IPv4     Fragmented IP protocol (proto=ICMP 1, off=1480, ID=cce5) [Reassembled in #18]

Frame 17: 1514 bytes on wire (12112 bits), 1514 bytes captured (12112 bits) on interface 0
    Interface id: 0 (enp4s0)
    Encapsulation type: Ethernet (1)
    Arrival Time: Nov  6, 2017 12:10:29.018334668 WET
    [Time shift for this packet: 0.000000000 seconds]
    Epoch Time: 1509970229.018334668 seconds
    [Time delta from previous captured frame: 0.000002359 seconds]
    [Time delta from previous displayed frame: 0.000002359 seconds]
    [Time since reference or first frame: 1.252774990 seconds]
    Frame Number: 17
    Frame Length: 1514 bytes (12112 bits)
    Capture Length: 1514 bytes (12112 bits)
    [Frame is marked: False]
    [Frame is ignored: False]
    [Protocols in frame: eth:ethertype:ip:data]
    [Coloring Rule Name: TTL low or unexpected]
    [Coloring Rule String: ( ! ip.dst == 224.0.0.0/4 && ip.ttl < 5 && !pim && !ospf) || (ip.dst == 224.0.0.0/24 && ip.dst != 224.0.0.251 && ip.ttl != 1 && !(vrrp || carp))]
Ethernet II, Src: Pegatron_49:f9:c2 (00:71:c2:49:f9:c2), Dst: Vmware_1d:41:ec (00:0c:29:1d:41:ec)
Internet Protocol Version 4, Src: 192.168.73.201, Dst: 193.136.9.254
    0100 .... = Version: 4
    .... 0101 = Header Length: 20 bytes (5)
    Differentiated Services Field: 0x00 (DSCP: CS0, ECN: Not-ECT)
    Total Length: 1500
    Identification: 0xcce5 (52453)
    Flags: 0x01 (More Fragments)
    Fragment offset: 1480
    Time to live: 1
    Protocol: ICMP (1)
    Header checksum: 0xf08a [validation disabled]
    [Header checksum status: Unverified]
    Source: 192.168.73.201
    Destination: 193.136.9.254
    [Source GeoIP: Unknown]
    [Destination GeoIP: Portugal]
    Reassembled IPv4 in frame: 18
Data (1480 bytes)

0000  48 49 4a 4b 4c 4d 4e 4f 50 51 52 53 54 55 56 57   HIJKLMNOPQRSTUVW
0010  58 59 5a 5b 5c 5d 5e 5f 60 61 62 63 64 65 66 67   XYZ[\]^_`abcdefg
0020  68 69 6a 6b 6c 6d 6e 6f 70 71 72 73 74 75 76 77   hijklmnopqrstuvw
0030  78 79 7a 7b 7c 7d 7e 7f 40 41 42 43 44 45 46 47   xyz{|}~.@ABCDEFG
0040  48 49 4a 4b 4c 4d 4e 4f 50 51 52 53 54 55 56 57   HIJKLMNOPQRSTUVW
0050  58 59 5a 5b 5c 5d 5e 5f 60 61 62 63 64 65 66 67   XYZ[\]^_`abcdefg
0060  68 69 6a 6b 6c 6d 6e 6f 70 71 72 73 74 75 76 77   hijklmnopqrstuvw
0070  78 79 7a 7b 7c 7d 7e 7f 40 41 42 43 44 45 46 47   xyz{|}~.@ABCDEFG
0080  48 49 4a 4b 4c 4d 4e 4f 50 51 52 53 54 55 56 57   HIJKLMNOPQRSTUVW
0090  58 59 5a 5b 5c 5d 5e 5f 60 61 62 63 64 65 66 67   XYZ[\]^_`abcdefg
00a0  68 69 6a 6b 6c 6d 6e 6f 70 71 72 73 74 75 76 77   hijklmnopqrstuvw
00b0  78 79 7a 7b 7c 7d 7e 7f 40 41 42 43 44 45 46 47   xyz{|}~.@ABCDEFG
00c0  48 49 4a 4b 4c 4d 4e 4f 50 51 52 53 54 55 56 57   HIJKLMNOPQRSTUVW
00d0  58 59 5a 5b 5c 5d 5e 5f 60 61 62 63 64 65 66 67   XYZ[\]^_`abcdefg
00e0  68 69 6a 6b 6c 6d 6e 6f 70 71 72 73 74 75 76 77   hijklmnopqrstuvw
00f0  78 79 7a 7b 7c 7d 7e 7f 40 41 42 43 44 45 46 47   xyz{|}~.@ABCDEFG
0100  48 49 4a 4b 4c 4d 4e 4f 50 51 52 53 54 55 56 57   HIJKLMNOPQRSTUVW
0110  58 59 5a 5b 5c 5d 5e 5f 60 61 62 63 64 65 66 67   XYZ[\]^_`abcdefg
0120  68 69 6a 6b 6c 6d 6e 6f 70 71 72 73 74 75 76 77   hijklmnopqrstuvw
0130  78 79 7a 7b 7c 7d 7e 7f 40 41 42 43 44 45 46 47   xyz{|}~.@ABCDEFG
0140  48 49 4a 4b 4c 4d 4e 4f 50 51 52 53 54 55 56 57   HIJKLMNOPQRSTUVW
0150  58 59 5a 5b 5c 5d 5e 5f 60 61 62 63 64 65 66 67   XYZ[\]^_`abcdefg
0160  68 69 6a 6b 6c 6d 6e 6f 70 71 72 73 74 75 76 77   hijklmnopqrstuvw
0170  78 79 7a 7b 7c 7d 7e 7f 40 41 42 43 44 45 46 47   xyz{|}~.@ABCDEFG
0180  48 49 4a 4b 4c 4d 4e 4f 50 51 52 53 54 55 56 57   HIJKLMNOPQRSTUVW
0190  58 59 5a 5b 5c 5d 5e 5f 60 61 62 63 64 65 66 67   XYZ[\]^_`abcdefg
01a0  68 69 6a 6b 6c 6d 6e 6f 70 71 72 73 74 75 76 77   hijklmnopqrstuvw
01b0  78 79 7a 7b 7c 7d 7e 7f 40 41 42 43 44 45 46 47   xyz{|}~.@ABCDEFG
01c0  48 49 4a 4b 4c 4d 4e 4f 50 51 52 53 54 55 56 57   HIJKLMNOPQRSTUVW
01d0  58 59 5a 5b 5c 5d 5e 5f 60 61 62 63 64 65 66 67   XYZ[\]^_`abcdefg
01e0  68 69 6a 6b 6c 6d 6e 6f 70 71 72 73 74 75 76 77   hijklmnopqrstuvw
01f0  78 79 7a 7b 7c 7d 7e 7f 40 41 42 43 44 45 46 47   xyz{|}~.@ABCDEFG
0200  48 49 4a 4b 4c 4d 4e 4f 50 51 52 53 54 55 56 57   HIJKLMNOPQRSTUVW
0210  58 59 5a 5b 5c 5d 5e 5f 60 61 62 63 64 65 66 67   XYZ[\]^_`abcdefg
0220  68 69 6a 6b 6c 6d 6e 6f 70 71 72 73 74 75 76 77   hijklmnopqrstuvw
0230  78 79 7a 7b 7c 7d 7e 7f 40 41 42 43 44 45 46 47   xyz{|}~.@ABCDEFG
0240  48 49 4a 4b 4c 4d 4e 4f 50 51 52 53 54 55 56 57   HIJKLMNOPQRSTUVW
0250  58 59 5a 5b 5c 5d 5e 5f 60 61 62 63 64 65 66 67   XYZ[\]^_`abcdefg
0260  68 69 6a 6b 6c 6d 6e 6f 70 71 72 73 74 75 76 77   hijklmnopqrstuvw
0270  78 79 7a 7b 7c 7d 7e 7f 40 41 42 43 44 45 46 47   xyz{|}~.@ABCDEFG
0280  48 49 4a 4b 4c 4d 4e 4f 50 51 52 53 54 55 56 57   HIJKLMNOPQRSTUVW
0290  58 59 5a 5b 5c 5d 5e 5f 60 61 62 63 64 65 66 67   XYZ[\]^_`abcdefg
02a0  68 69 6a 6b 6c 6d 6e 6f 70 71 72 73 74 75 76 77   hijklmnopqrstuvw
02b0  78 79 7a 7b 7c 7d 7e 7f 40 41 42 43 44 45 46 47   xyz{|}~.@ABCDEFG
02c0  48 49 4a 4b 4c 4d 4e 4f 50 51 52 53 54 55 56 57   HIJKLMNOPQRSTUVW
02d0  58 59 5a 5b 5c 5d 5e 5f 60 61 62 63 64 65 66 67   XYZ[\]^_`abcdefg
02e0  68 69 6a 6b 6c 6d 6e 6f 70 71 72 73 74 75 76 77   hijklmnopqrstuvw
02f0  78 79 7a 7b 7c 7d 7e 7f 40 41 42 43 44 45 46 47   xyz{|}~.@ABCDEFG
0300  48 49 4a 4b 4c 4d 4e 4f 50 51 52 53 54 55 56 57   HIJKLMNOPQRSTUVW
0310  58 59 5a 5b 5c 5d 5e 5f 60 61 62 63 64 65 66 67   XYZ[\]^_`abcdefg
0320  68 69 6a 6b 6c 6d 6e 6f 70 71 72 73 74 75 76 77   hijklmnopqrstuvw
0330  78 79 7a 7b 7c 7d 7e 7f 40 41 42 43 44 45 46 47   xyz{|}~.@ABCDEFG
